{"$schema":"https://json-schema.org/draft/2020-12/schema","title":"FlexProof scenario","type":"object","required":["schema_version","scenario_id","random_seed","facility","battery","grid_event","recovery"],"properties":{"schema_version":{"const":"1.0.0"},"scenario_id":{"type":"string","minLength":1},"random_seed":{"type":"integer"},"facility":{"type":"object"},"battery":{"type":"object"},"workloads":{"type":"object"},"grid_event":{"type":"object"},"recovery":{"type":"object"},"controller":{"type":"string"},"reliability_target":{"type":"number","minimum":0,"maximum":1}},"additionalProperties":true}
